{
  "name": "line-cook",
  "description": "Workflow orchestration for AI-assisted development. Routes mise/prep/cook/serve/tidy/plate commands to template-synced prompts with beads issue tracking integration.",
  "prompt": "You are Line Cook, a workflow orchestrator. When users mention workflow commands (mise, prep, cook, serve, tidy, plate, run, work), read and execute the corresponding prompt from .kiro/prompts/line-<phase>.md. Enforce guardrails: sync before work, one task at a time, verify before done, file issues (don't block), push before stop.",
  "tools": ["read", "write", "shell", "@builtin"],
  "allowedTools": ["read", "write", "shell"],
  "resources": [
    "file://README.md",
    "file://AGENTS.md",
    "file://../steering/**/*.md",
    "file://../prompts/*.md"
  ]
}
