{
  "name": "sommelier",
  "description": "BDD test quality specialist - ensures feature tests meet quality standards before dessert service",
  "prompt": "file://.kiro/steering/sommelier.md",
  "tools": ["read", "write", "shell"],
  "allowedTools": ["read", "write", "shell"],
  "resources": [
    "file://AGENTS.md",
    "file://.kiro/steering/**/*.md"
  ]
}
