{
  "name": "sous-chef",
  "description": "Code review specialist - ensures code quality before commit in Line Cook workflow",
  "prompt": "file://../steering/sous-chef.md",
  "tools": ["read", "shell"],
  "allowedTools": ["read", "shell"],
  "resources": [
    "file://AGENTS.md",
    "file://../steering/**/*.md"
  ]
}
